{
	"schema": "hiviz@1",
	"name": "Vertical headline",
	"description": "Vertical 4K layout with a quick highlight on a single keyword.",
	"state": {
		"transport": {
			"orientation": "vertical",
			"durationSeconds": 5,
			"fps": 30,
			"format": "webm"
		},
		"typography": {
			"fontFamily": "condensed",
			"paperColor": "#ffffff",
			"inkColor": "#0a0a0a"
		},
		"marks": {
			"defaults": {
				"highlight": {
					"color": "#ffe066",
					"intensity": 0.72
				},
				"underline": {
					"color": "#1f5aff",
					"intensity": 0.62
				},
				"strike": {
					"color": "#de263a",
					"intensity": 0.62
				},
				"circle": {
					"color": "#de263a",
					"intensity": 0.66
				}
			},
			"timings": [
				{
					"start": 0.4,
					"duration": 0.2,
					"ease": "sharp"
				}
			]
		},
		"surface": {
			"type": "research-paper",
			"content": {
				"title": "Scaling Laws for Neural Language Models",
				"sourceUrl": "https://arxiv.org/abs/2001.08361",
				"body": "We study empirical scaling laws for language model performance on the cross-entropy loss.\n\nThe loss scales as a power-law with [highlight]model size[/highlight], dataset size, and the amount of compute used for training, with some trends spanning more than seven orders of magnitude."
			},
			"enter": {
				"start": 0,
				"duration": 0.22,
				"ease": "settled"
			},
			"exit": {
				"start": 0.8,
				"duration": 0.2,
				"ease": "smooth"
			}
		}
	}
}
