{
	"schema": "hiviz@1",
	"name": "Tear-out emphasis",
	"description": "Tear-out treatment with a circled mark and snap zoom toward the quote.",
	"state": {
		"transport": {
			"orientation": "horizontal",
			"durationSeconds": 7,
			"fps": 30,
			"format": "webm"
		},
		"typography": {
			"fontFamily": "sans",
			"paperColor": "#fafafa",
			"inkColor": "#0a0a0a"
		},
		"marks": {
			"defaults": {
				"highlight": {
					"color": "#ffe066",
					"intensity": 0.55
				},
				"underline": {
					"color": "#1f5aff",
					"intensity": 0.6
				},
				"strike": {
					"color": "#de263a",
					"intensity": 0.6
				},
				"circle": {
					"color": "#de263a",
					"intensity": 0.74
				}
			},
			"timings": []
		},
		"surface": {
			"type": "quote-focus",
			"content": {
				"body": "Trust the process. Most teams overweight the milestone announcement and underweight the daily standup; the announcement is performative, the standup is corrective. The teams that ship steadily over years almost always run the same boring rhythm, not because rhythm is glamorous, but because [highlight]rhythm exposes drift fast enough to be cheap[/highlight].",
				"author": "Internal memo",
				"source": "Field notes",
				"dateLabel": "2024"
			},
			"focus": {
				"start": 0.18,
				"duration": 0.32,
				"ease": "settled",
				"style": "tear-out"
			},
			"mark": {
				"start": 0.5,
				"duration": 0.26,
				"ease": "sharp",
				"style": "circle"
			},
			"camera": "snap",
			"backgroundVisibility": 0.12,
			"showSourceMetadata": true
		}
	}
}
