{
	"schema": "hiviz@1",
	"name": "Magnify with side note",
	"description": "Magnify treatment with a side-note arrow that calls out the attribution.",
	"state": {
		"transport": {
			"orientation": "horizontal",
			"durationSeconds": 8,
			"fps": 30,
			"format": "webm"
		},
		"typography": {
			"fontFamily": "serif",
			"paperColor": "#ffffff",
			"inkColor": "#111111"
		},
		"marks": {
			"defaults": {
				"highlight": {
					"color": "#ffd642",
					"intensity": 0.66
				},
				"underline": {
					"color": "#1f5aff",
					"intensity": 0.6
				},
				"strike": {
					"color": "#de263a",
					"intensity": 0.6
				},
				"circle": {
					"color": "#de263a",
					"intensity": 0.6
				}
			},
			"timings": []
		},
		"surface": {
			"type": "quote-focus",
			"content": {
				"body": "Software engineering is more like gardening than building. You plant, you tend, you prune. [highlight]The work that lasts is the work that responds gracefully to weather you did not predict[/highlight], and the work that fails is the work that demands the weather to behave.",
				"author": "Notebooks",
				"source": "Talks I have not given",
				"dateLabel": "2023"
			},
			"focus": {
				"start": 0.2,
				"duration": 0.3,
				"ease": "smooth",
				"style": "magnify"
			},
			"mark": {
				"start": 0.46,
				"duration": 0.34,
				"ease": "smooth",
				"style": "side-note"
			},
			"camera": "none",
			"backgroundVisibility": 0.3,
			"showSourceMetadata": true
		}
	}
}
